board_no,member_no,title,content,views,create_date,status,original_filename,renameed_filename,,,,,,,
45,9,이직 후 데스크의 반응이 익숙해지지 않습니다. 잦은 이직 괜찮을까요?,"안녕하세요. 대학 졸업 이후부터 기자로 일하고 있는 30대입니다. 이직한지는 3개월이 안됐네요. 

최근 고민은 저에 대한 데스크의 반응이 날카롭게 느껴지는데, 이유를 알려주지 않는다는 점입니다. 

해당 매체에서 제게 원하는건 2가지였습니다. 이전 매체에서 맡았던 분야를 계속 맡아줄 것. 그리고 새로운 분야도 더 맡아줄 것. 새로운 분야들이 다소 전문적이고 지엽적인 분야라 발제 주제를 찾기 쉽지 않았습니다. 그래도 정말 친절한 선배 아래에서 잘 배우고 있습니다. 

다만 데스크의 반응이 좋지 않습니다. 가장 힘든 부분은 비난에 가까운 피드백입니다. 

1. 발제 주제를 앞서 보고했음에도 기사 작성 이후 주제를 문제 삼아 킬. 
2. 작성한 기사에 대해 못 나간다고 말하지만 이유를 물어봐도 그냥 못 나간다고 킬. 
3. 발제 승인 신청을 올려뒀으나 하루, 이틀정도 이후에 시의성 or 이유를 말하지 않고 삭제처리
....
등이 있는데 이 과정에서 기자의 자질이 안되네, 취재력이 부족하면 다른 매체 우라까이라도 해야지, 뭐가 문제인지 정말 모르겠냐 등의 말을 모두가 계신 사무실에서 하셔서 수치스럽습니다. ",975,05월 13일,공개,None,None,,,,,,,
46,10,4년차 디자이너 연봉,"경력이 좀 쪼개져있어서 이것저것 다 모으면 3년 꽉 차는 거 같아요
넘게 되면 4년차 맞죠?

이번에 다니는 회사에서 1년 됐고 연협 3800(세전)으로 올렸습니다
식대는 월 10 따로 받고요
운영 콘텐츠 쪽 디자인하고 있고
나름 만족하는 수준이었는데 생각보다 요즘 평균연봉이 많이 오른 것 같아서요

96년생 나이와 연차대비 객관적으로 어떤 것 같나요",15,06월 02일,공개,None,None,,,,,,,
47,10,2년차 스타트업 디자이너의 고민,"스타트업에서 콘텐츠 디자이너로 일한지 2년이 되어가는 26살 디자이너입니다.
말이 콘텐츠 디자이너지 브랜딩부터 오프라인 마케팅 디자인까지 도맡아 해왔는데요.

대학 졸업때부터 bx디자이너를 꿈꿔왔는데 주변의 UXUI 디자이너를 보면서
이 분야에 대해 관심이 생겼습니다. 아차 싶었던게 UXUI를 한번도 제대로 접해보지
않고서 익숙한 브랜딩의 길로만 고민한 건 아닌지 싶더라구요.

현재 시점에서(내년 상반기 이직 계획) 브랜딩에 대한 역량 강화를 하는 게 맞는 것인지
UX/UI 분야를 한 번 제대로 배워보는게 맞을지 (배워보니 적성에 맞을지도 모르니까?)
고민입니다... 조언 부탁드려도 될까요",46,06월 02일,공개,None,None,,,,,,,
48,10,이직고민,"안녕하세요 첫회사로 입사해서 꽉채운 4년,
년차로는 5년차 디자이너입니다.

지금 다니고 있는 회사가 정해진 프로젝트로 돌아가는 회사라
바쁠때는 주말없이 공휴일없이 새벽까지 일하는게 일상이지만
프로젝트가 끝나면 기여도에 따른 성과금이 나오고
최소 한달 길면 두세달은 아무 일도 하지 않습니다.

이런 일 방식들이 저에게도 잘 맞고 ..
힘들지만 재밌다고 생각했습니다.

그런데 요즘은 정해진 프로젝트 이외에도
다른 일들을 받기 시작해서 업무량이 점점 더 늘어나고
성과금은 현저히 줄어들었어요

아무래도 일이 갑자기 들어오다보니 여행이나 주말일정을 
포기한적도 많아서 현타와 이해의 반복이었는데
사람들이 너무 좋아서 잘 버텨왔던 것 같습니다.

그런데 이번에는 정말 강력한 현타가 와버렸어요..
왜 이렇게까지 살아야 하나 싶어서 이직을 결심하다가도
좋은 순간들이 오면 또 다시 속게 됩니다.
왜 이 회사를 쉽게 놓지 못할까에 대한 고민을 해본결과
첫 이직인만큼 두려움도 크고 편안함을 잃는 것
+업무의 퀄리티가 높다
인데.. 제가 지금 너무 우물 안 개구리일까요",60,06월 02일,공개,None,None,,,,,,,
49,10,컨텐츠/프로덕트 디자이너,"웹에이전시에서 5년정도 일했습니다.
사정이있어 그만두고 일년반정도 지났는데요..

에이전시에서 일했던지라 UT나 AB test등 데이터로 디자인검증을 한적도없고.. ux를 고민하지않고 디자인한건 아니지만 그렇다고 제대로된 ux설계서도 작성해본적이 없습니다.

또한 앱을 디자인을해서 런칭해본적도없고요

상세페이지는 만들어봤지만 마케터와 협업해 프로모션디자인을 하거나 해본적은 없구요

작업툴이나 디스플레이에따른 ui디자인은 가능하지만
그 외에 내세울게없어요

인하우스로 이직 희망했지만 상황이이러니 컨텐츠 디자이너를 하기에도, 프로덕트디자이너를 하기에도 애매한거같아요. 프로덕트 디자이너는 대부분 3년이상 이 기본이더라구요.
현재 프로덕트 디자이너 공고에도 몇번탈락햇구용..
운좋게 서합 후 좋은곳에 면접을가도 말문이막혀요..

프로덕트디자이너를 하게된다면 요즘 많이 듣는 온라인수업이라도 듣고 빠르게 2-3개월 포트폴리오를 준비를해야할 것 같은데, 주위에서 온라인수업을 직접 들어보신분들이 없어 이게 가능한건지도 모르겠습니다.
(2-3개월이라는건 리멤버나 브런치등 글을 읽어보면 그걸 추천하시는분이나 하신분이 있어 가늠만 하고있을뿐이에요.)

전 직무와 유사했던 컨텐츠 디자인 포트폴리오를 빠르게 만들어 취업하고 이후에 3d,에펙 공부를해 커리어를 쌓을지

그래도 시간을들여 프로덕트디자이너로 전환해 신입부터 시작 후 커리어를 쌓을지..

제일 중요한건 제가 하고싶은게 뭔지 결정해야되는데,
일년반 넘게 쉬다보니 조급해지는감이있어 뭘 해야 이 상황에 맞는건지 모르겟어요..",429,05월 22일,공개,None,None,,,,,,,
50,10,웹디자이너 경력 7년차 연봉고민입니다,"엄청 고민하다가 글씁니다
지금 다니는 직장 6년쯤 된거같네요 스타트업디자이너로 시작해서 지금은 브랜드만 3개정도 쇼핑몰입니다.

디자인팀 팀장(대리)로 있구요
경기도권 중소기업 디자인팀 팀장이래바야..뭐..일제일많이하고 제일오래됬으니까 준거같긴하지만
연봉 3천초중반정도 받고있습니다
패키지디자인,제품디자인,배너,상세컨텐츠디자인,영상(숏츠)작업,제품촬영을 하고있는데

나름 박봉인걸 알면서도 재직중에있었네요
이번에 연봉협상문제가 나와서 ( 2년반째 연봉인상없음,내일채움공재연봉이라고함,연봉인상요청거절)
정말 고민중입니다
벌써 30대 중반인나이에 다른직장으로 이직 갈수있을지도 걱정이고
한회사만 오래다니다보니 박봉인줄도 모르고있었네요
보통 평균연봉은 어느정도 하는지알고싶습니다
그리고 보통 ㅈㅅ기업 웹디자이너가 하는일이 이렇게 많은가요?",603,05월 17일,공개,None,None,,,,,,,
